{
  "batch_id": "deep-other-01",
  "research_completed_at": "2026-09-18T16:25:29+09:00",
  "results": [
    {
      "field_results": [
        {
          "confidence": 0.0,
          "evidence": [],
          "evidence_status": "NOT_FOUND",
          "field_path": "specs.dimensions",
          "normalized_unit": null,
          "normalized_value": null,
          "notes": "Допустимый официальный источник производителя или доказанного авторизованного партнёра не найден; сторонние публикации отклонены."
        },
        {
          "confidence": 0.0,
          "evidence": [],
          "evidence_status": "NOT_FOUND",
          "field_path": "specs.integrations",
          "normalized_unit": null,
          "normalized_value": null,
          "notes": "Допустимый официальный источник производителя или доказанного авторизованного партнёра не найден; сторонние публикации отклонены."
        },
        {
          "confidence": 0.0,
          "evidence": [],
          "evidence_status": "NOT_FOUND",
          "field_path": "specs.operating_conditions",
          "normalized_unit": null,
          "normalized_value": null,
          "notes": "Допустимый официальный источник производителя или доказанного авторизованного партнёра не найден; сторонние публикации отклонены."
        },
        {
          "confidence": 0.0,
          "evidence": [],
          "evidence_status": "NOT_FOUND",
          "field_path": "specs.payload",
          "normalized_unit": null,
          "normalized_value": null,
          "notes": "Допустимый официальный источник производителя или доказанного авторизованного партнёра не найден; сторонние публикации отклонены."
        },
        {
          "confidence": 0.0,
          "evidence": [],
          "evidence_status": "NOT_FOUND",
          "field_path": "specs.positioning_accuracy",
          "normalized_unit": null,
          "normalized_value": null,
          "notes": "Допустимый официальный источник производителя или доказанного авторизованного партнёра не найден; сторонние публикации отклонены."
        },
        {
          "confidence": 0.0,
          "evidence": [],
          "evidence_status": "NOT_FOUND",
          "field_path": "specs.service_requirements",
          "normalized_unit": null,
          "normalized_value": null,
          "notes": "Допустимый официальный источник производителя или доказанного авторизованного партнёра не найден; сторонние публикации отклонены."
        },
        {
          "confidence": 0.0,
          "evidence": [],
          "evidence_status": "NOT_FOUND",
          "field_path": "specs.throughput",
          "normalized_unit": null,
          "normalized_value": null,
          "notes": "Допустимый официальный источник производителя или доказанного авторизованного партнёра не найден; сторонние публикации отклонены."
        }
      ],
      "identity_status": "MODEL_NOT_FOUND",
      "matched_manufacturer": "ООО \"Битроботикс\"",
      "matched_model": null,
      "organizer_id": "22b5ba99-bc4f-46a7-9a9b-e4475ecd9fc7",
      "unresolved_issues": [
        "Research returned only non-official third-party sources for candidate facts; all such facts were rejected during local repair."
      ]
    },
    {
      "field_results": [
        {
          "confidence": 0.0,
          "evidence": [],
          "evidence_status": "NOT_FOUND",
          "field_path": "capacity.elevator_compatibility",
          "normalized_unit": null,
          "normalized_value": null,
          "notes": "Допустимый официальный источник производителя или доказанного авторизованного партнёра не найден; сторонние публикации отклонены."
        },
        {
          "confidence": 0.0,
          "evidence": [],
          "evidence_status": "NOT_FOUND",
          "field_path": "capacity.exchange_time_s",
          "normalized_unit": null,
          "normalized_value": null,
          "notes": "Допустимый официальный источник производителя или доказанного авторизованного партнёра не найден; сторонние публикации отклонены."
        },
        {
          "confidence": 0.0,
          "evidence": [],
          "evidence_status": "NOT_FOUND",
          "field_path": "capacity.units_per_trip",
          "normalized_unit": null,
          "normalized_value": null,
          "notes": "Допустимый официальный источник производителя или доказанного авторизованного партнёра не найден; сторонние публикации отклонены."
        },
        {
          "confidence": 0.0,
          "evidence": [],
          "evidence_status": "NOT_FOUND",
          "field_path": "specs.autonomy",
          "normalized_unit": null,
          "normalized_value": null,
          "notes": "Допустимый официальный источник производителя или доказанного авторизованного партнёра не найден; сторонние публикации отклонены."
        },
        {
          "confidence": 0.0,
          "evidence": [],
          "evidence_status": "NOT_FOUND",
          "field_path": "specs.charging_requirements",
          "normalized_unit": null,
          "normalized_value": null,
          "notes": "Допустимый официальный источник производителя или доказанного авторизованного партнёра не найден; сторонние публикации отклонены."
        },
        {
          "confidence": 0.0,
          "evidence": [],
          "evidence_status": "NOT_FOUND",
          "field_path": "specs.connectivity",
          "normalized_unit": null,
          "normalized_value": null,
          "notes": "Допустимый официальный источник производителя или доказанного авторизованного партнёра не найден; сторонние публикации отклонены."
        },
        {
          "confidence": 0.0,
          "evidence": [],
          "evidence_status": "NOT_FOUND",
          "field_path": "specs.integrations",
          "normalized_unit": null,
          "normalized_value": null,
          "notes": "Допустимый официальный источник производителя или доказанного авторизованного партнёра не найден; сторонние публикации отклонены."
        },
        {
          "confidence": 0.0,
          "evidence": [],
          "evidence_status": "NOT_FOUND",
          "field_path": "specs.max_speed",
          "normalized_unit": null,
          "normalized_value": null,
          "notes": "Допустимый официальный источник производителя или доказанного авторизованного партнёра не найден; сторонние публикации отклонены."
        },
        {
          "confidence": 0.0,
          "evidence": [],
          "evidence_status": "NOT_FOUND",
          "field_path": "specs.min_aisle_width",
          "normalized_unit": null,
          "normalized_value": null,
          "notes": "Допустимый официальный источник производителя или доказанного авторизованного партнёра не найден; сторонние публикации отклонены."
        },
        {
          "confidence": 0.0,
          "evidence": [],
          "evidence_status": "NOT_FOUND",
          "field_path": "specs.navigation",
          "normalized_unit": null,
          "normalized_value": null,
          "notes": "Допустимый официальный источник производителя или доказанного авторизованного партнёра не найден; сторонние публикации отклонены."
        },
        {
          "confidence": 0.0,
          "evidence": [],
          "evidence_status": "NOT_FOUND",
          "field_path": "specs.operating_conditions",
          "normalized_unit": null,
          "normalized_value": null,
          "notes": "Допустимый официальный источник производителя или доказанного авторизованного партнёра не найден; сторонние публикации отклонены."
        },
        {
          "confidence": 0.0,
          "evidence": [],
          "evidence_status": "NOT_FOUND",
          "field_path": "specs.payload",
          "normalized_unit": null,
          "normalized_value": null,
          "notes": "Допустимый официальный источник производителя или доказанного авторизованного партнёра не найден; сторонние публикации отклонены."
        },
        {
          "confidence": 0.0,
          "evidence": [],
          "evidence_status": "NOT_FOUND",
          "field_path": "specs.service_requirements",
          "normalized_unit": null,
          "normalized_value": null,
          "notes": "Допустимый официальный источник производителя или доказанного авторизованного партнёра не найден; сторонние публикации отклонены."
        },
        {
          "confidence": 0.0,
          "evidence": [],
          "evidence_status": "NOT_FOUND",
          "field_path": "specs.surface_requirements",
          "normalized_unit": null,
          "normalized_value": null,
          "notes": "Допустимый официальный источник производителя или доказанного авторизованного партнёра не найден; сторонние публикации отклонены."
        }
      ],
      "identity_status": "MODEL_NOT_FOUND",
      "matched_manufacturer": "ООО \"Дронсхаб\"",
      "matched_model": null,
      "organizer_id": "cdf80f5b-c60a-447b-af30-2c8a44480f98",
      "unresolved_issues": [
        "Research returned only non-official third-party sources for candidate facts; all such facts were rejected during local repair."
      ]
    },
    {
      "field_results": [
        {
          "confidence": 0.0,
          "evidence": [],
          "evidence_status": "NOT_FOUND",
          "field_path": "specs.dimensions",
          "normalized_unit": null,
          "normalized_value": null,
          "notes": "Допустимый официальный источник производителя или доказанного авторизованного партнёра не найден; сторонние публикации отклонены."
        },
        {
          "confidence": 0.0,
          "evidence": [],
          "evidence_status": "NOT_FOUND",
          "field_path": "specs.integrations",
          "normalized_unit": null,
          "normalized_value": null,
          "notes": "Допустимый официальный источник производителя или доказанного авторизованного партнёра не найден; сторонние публикации отклонены."
        },
        {
          "confidence": 0.0,
          "evidence": [],
          "evidence_status": "NOT_FOUND",